{
  "$schema": "http://json-schema.org/draft-07/schema#",
  "$id": "https://raw.githubusercontent.com/benfrancisburns-creator/terminal-talk/main/config.schema.json",
  "title": "Terminal Talk config.json",
  "description": "User-facing configuration for Terminal Talk. Edit ~/.terminal-talk/config.json to override defaults. VS Code and any editor that honours `$schema` / `json.schemas` will autocomplete these keys and validate values on save.",
  "type": "object",
  "additionalProperties": false,
  "properties": {
    "voices": {
      "type": "object",
      "description": "Voice IDs for TTS playback. See app/lib/voices.json for the full 47-entry edge + 6-entry openai catalogue.",
      "properties": {
        "edge_clip": { "type": "string", "maxLength": 80, "description": "Voice for highlight-to-speak clips." },
        "edge_response": { "type": "string", "maxLength": 80, "description": "Voice for assistant response playback." },
        "openai_clip": { "type": "string", "maxLength": 80, "description": "Used only when openai_api_key is set (premium fallback)." },
        "openai_response": { "type": "string", "maxLength": 80 }
      }
    },
    "hotkeys": {
      "type": "object",
      "description": "Electron globalShortcut strings — e.g. 'Control+Shift+A'.",
      "properties": {
        "toggle_window":    { "type": "string", "maxLength": 64 },
        "speak_clipboard":  { "type": "string", "maxLength": 64 },
        "toggle_listening": { "type": "string", "maxLength": 64 },
        "dictate_paste":    { "type": "string", "maxLength": 64 },
        "dictate_toggle":   { "type": "string", "maxLength": 64 },
        "pause_resume":     { "type": "string", "maxLength": 64 },
        "pause_only":       { "type": "string", "maxLength": 64 },
        "start_dictation":  { "type": "string", "maxLength": 64 }
      }
    },
    "playback": {
      "type": "object",
      "properties": {
        "speed":          { "type": "number", "minimum": 0.25, "maximum": 4.0, "default": 1.25 },
        "master_volume":  { "type": "number", "minimum": 0.0, "maximum": 1.0, "default": 1.0, "description": "Master output volume 0.0–1.0 (settings panel slider). Heartbeat clips stay at 0.45× this value, body/tool clips at 1.0×, so the mix ratio is preserved at any master level." },
        "collapse_delay_sec": { "type": "integer", "minimum": 1, "maximum": 120, "default": 3, "description": "How long the toolbar stays expanded after the last interaction before it auto-collapses to the slim click-through strip. Playback keeps the collapsed strip coloured by the speaking session instead of pinning the full toolbar open." },
        "auto_prune":     { "type": "boolean", "default": true },
        "auto_prune_sec": { "type": "integer", "minimum": 1, "maximum": 600, "default": 20 },
        "auto_continue_after_click": { "type": "boolean", "default": true, "description": "When on, clicking a dot plays that clip and auto-continues through the remaining clips in time order — regardless of whether they were already heard. When off, a click plays only the clicked clip." },
        "recap_keep_min": { "type": "integer", "minimum": 0, "maximum": 1440, "default": 120, "description": "Session recap: how many minutes played or cleared assistant body clips stay in ~/.terminal-talk/queue/recap/ so a session tab's Recap control can replay the last N clips or the last M minutes of audio. 0 disables the archive (clips are deleted as before). Tool-narration, heartbeat and highlight-to-speak clips are never kept." },
        "palette_variant": { "type": "string", "enum": ["default", "cb"], "default": "default", "description": "Colour palette variant. 'default' = the standard 8-colour palette; 'cb' = colour-blind-friendly (Paul Tol's 'muted' scheme, distinguishable under deutan/protan/tritan). EX5 / H3 Option 2." },
        "tts_provider": { "type": "string", "enum": ["edge", "openai"], "default": "edge", "description": "Which TTS provider to try first. 'edge' = Microsoft edge-tts (free, no key, default). 'openai' = OpenAI TTS (paid, needs openai_api_key configured)." },
        "tts_fallback_provider": { "type": "string", "enum": ["edge", "openai", "none"], "default": "edge", "description": "Which provider to try if the primary provider fails. Default 'edge' keeps fallback free and prevents hidden OpenAI credit spend when Edge is primary. Set to 'openai' only if you intentionally want paid fallback; monitor credits or enable OpenAI billing auto top-up/auto recharge. Set to 'none' to disable fallback." }
      }
    },
    "dictation": {
      "type": "object",
      "description": "Local Whisper dictation cleanup. The default local cleanup is free. Set cleanup_provider to 'openai' only if you intentionally want a paid LLM cleanup pass for Wispr-style punctuation, paragraphs, and list formatting.",
      "properties": {
        "cleanup": { "type": "boolean", "default": true, "description": "When true, clean raw Whisper output before copy/paste by removing filler words and applying spoken formatting commands." },
        "cleanup_provider": { "type": "string", "enum": ["local", "openai"], "default": "local", "description": "'local' runs deterministic no-cost cleanup. 'openai' sends dictated text to OpenAI using the saved API key and falls back to local cleanup on failure." },
        "cleanup_model": { "type": "string", "maxLength": 80, "default": "gpt-5.4-mini", "description": "OpenAI model used only when dictation.cleanup_provider is 'openai'." },
        "cleanup_timeout_sec": { "type": "integer", "minimum": 3, "maximum": 60, "default": 20 },
        "keep_audio": { "type": "boolean", "default": false, "description": "When true, save each recorded dictation as a WAV beside the transcript for debugging and review." },
        "save_timing": { "type": "boolean", "default": true, "description": "When true, save Whisper segment and word-pause metadata as a .segments.json sidecar." }
      }
    },
    "speech_includes": {
      "type": "object",
      "description": "Which markdown features get read aloud. Per-session overrides live in the sessions panel.",
      "properties": {
        "code_blocks":    { "type": "boolean" },
        "inline_code":    { "type": "boolean" },
        "urls":           { "type": "boolean" },
        "headings":       { "type": "boolean" },
        "bullet_markers": { "type": "boolean" },
        "image_alt":      { "type": "boolean" },
        "tool_calls":     { "type": "boolean", "description": "Narrate tool progress as ephemeral T-prefixed clips. Claude uses hook-derived tool calls; Codex uses rollout-derived tool events when available. Default true." }
      }
    },
    "heartbeat_enabled": {
      "type": "boolean",
      "default": true,
      "description": "HB1 — global default. When Claude Code or Codex is actively working but the queue has been silent for 5 s, synthesise a spinner-verb ('Moonwalking', 'Pontificating') or thinking phrase as an ephemeral H-prefixed clip so you get audible confirmation the session is alive. Per-session heartbeat_enabled overrides can force on/off for one session."
    },
    "update_check_enabled": {
      "type": "boolean",
      "default": true,
      "description": "Phase 8 (#32): when the install lives in a git checkout, periodically run `git fetch origin main` and surface a green badge on the gear icon if commits are ahead. Set false to disable network probes entirely. DMG / Homebrew installs no-op regardless because `git rev-parse` fails outside a repo."
    },
    "update_check_interval_min": {
      "type": "integer",
      "default": 60,
      "minimum": 5,
      "description": "Minutes between update-checker probes. First probe fires 15 s after toolbar boot to stay out of the way of other startup spawns; thereafter the interval drives. Re-reads the config on each tick so a change reflects without a toolbar restart."
    },
    "wake_words": {
      "type": "array",
      "default": ["hey_jarvis"],
      "items": { "type": "string" },
      "description": "Wake words the listener arms. Each entry is either a canned openWakeWord 0.6 model name (alexa, hey_jarvis, hey_mycroft, hey_rhasspy, timer, weather) OR an absolute path to a user-trained .onnx file under 5 MB. Invalid entries are skipped with a warning to _voice.log; if every entry is invalid the listener falls back to ['hey_jarvis']. Restart the toolbar (or kill the wake-word listener — the watchdog respawns it) for changes to take effect."
    },
    "panels": {
      "type": "object",
      "description": "UI panel persistence. Each sub-panel records its collapsed/expanded state and view mode so the toolbar restores exactly how the user left it.",
      "properties": {
        "transcript_expanded": { "type": "boolean", "default": false, "description": "Whether the transcript panel under the dot strip is open." },
        "transcript_view":     { "type": "string", "enum": ["spoken", "original"], "default": "spoken", "description": "Which text view the transcript panel shows: 'spoken' (post-strip-for-tts, what the audio actually says) or 'original' (pre-strip markdown source)." },
        "create_session_default_kind": { "type": "string", "enum": ["codex", "claude"], "default": "codex", "description": "Which assistant is preselected in the Settings > Sessions create-session form." },
        "create_session_defaults": {
          "type": "object",
          "description": "Saved defaults for launching new Codex / Claude Code sessions from the toolbar.",
          "properties": {
            "codex": {
              "type": "object",
              "properties": {
                "projectDir": { "type": "string", "maxLength": 4096 },
                "label": { "type": "string", "maxLength": 60 },
                "index": { "type": "number", "minimum": 0, "maximum": 23 },
                "launchMode": { "type": "string", "enum": ["default", "dangerous"] }
              }
            },
            "claude": {
              "type": "object",
              "properties": {
                "projectDir": { "type": "string", "maxLength": 4096 },
                "label": { "type": "string", "maxLength": 60 },
                "index": { "type": "number", "minimum": 0, "maximum": 23 },
                "launchMode": { "type": "string", "enum": ["default", "dangerous"] }
              }
            }
          }
        },
        "create_session_window_placements": {
          "type": "object",
          "description": "Optional advanced placement map for Settings > Sessions > Create session. Keys may be a label such as \"Claude TT A\", a slug such as \"claude-tt-a\", \"kind:label\", \"kind:index\", or \"kind\". Values may be a bounds string \"x,y,width,height\" or an object with windowPosition, windowSize, and windowBounds.",
          "additionalProperties": {
            "oneOf": [
              { "type": "string", "pattern": "^-?\\d+,-?\\d+,\\d+,\\d+$" },
              {
                "type": "object",
                "properties": {
                  "windowPosition": { "type": "string", "pattern": "^-?\\d+,-?\\d+$" },
                  "windowSize": { "type": "string", "pattern": "^\\d+,\\d+$" },
                  "windowBounds": { "type": "string", "pattern": "^-?\\d+,-?\\d+,\\d+,\\d+$" }
                },
                "additionalProperties": true
              }
            ]
          }
        }
      }
    },
    "window": {
      "type": ["object", "null"],
      "description": "Last-saved window position. Managed by main.js; don't hand-edit.",
      "additionalProperties": true
    },
    "openai_api_key": {
      "type": ["string", "null"],
      "maxLength": 200,
      "description": "Optional — premium TTS fallback. Stored encrypted via Electron safeStorage after v0.3 (see D2)."
    },
    "selected_tab": {
      "type": "string",
      "maxLength": 64,
      "default": "all",
      "description": "Last-selected dot-strip filter tab. 'all' = unfiltered chronological view; otherwise a session shortId. Managed by the toolbar; falls back to 'all' if the previously-selected session is gone."
    },
    "tabs_expanded": {
      "type": "boolean",
      "default": false,
      "description": "Whether the [▾ N idle] overflow row is expanded. Managed by the toolbar."
    },
    "_comment": {
      "type": "string",
      "description": "Free-form note. JSON has no native comments; _comment is ignored by the loader."
    }
  }
}
