{
  "$schema": "./config.schema.json",
  "_comment": "Copy to ~/.terminal-talk/config.json and edit. All fields optional; defaults apply. The $schema reference above gives VS Code + any editor that honours json.schemas autocomplete + validation on save.",

  "voices": {
    "_comment": "edge_* are free neural voices from Microsoft Edge. openai_* are premium voices used only when an OpenAI key is configured and OpenAI is selected as primary or fallback. Full Edge voice list: https://learn.microsoft.com/en-us/azure/ai-services/speech-service/language-support?tabs=tts",
    "edge_clip": "en-GB-SoniaNeural",
    "edge_response": "en-GB-RyanNeural",
    "openai_clip": "shimmer",
    "openai_response": "onyx"
  },

  "hotkeys": {
    "_comment": "Electron accelerator syntax: https://www.electronjs.org/docs/latest/api/accelerator",
    "toggle_window": "Control+Shift+A",
    "speak_clipboard": "Control+Shift+S",
    "toggle_listening": "Control+Shift+J",
    "dictate_paste": "Control+Alt+Space",
    "dictate_toggle": "Control+Shift+Space",
    "pause_resume": "Control+Shift+P",
    "pause_only": "Control+Shift+O",
    "start_dictation": "Control+Shift+D"
  },

  "playback": {
    "_comment": "speed 0.5-2.5x. master_volume is 0.0-1.0. collapse_delay_sec is how long the toolbar stays expanded while idle (1-120). auto_prune toggles whether played clips disappear after N seconds (3-600). recap_keep_min keeps played/cleared body clips in queue/recap for N minutes (0-1440, 0 = off) so a session tab's Recap control can replay them. tts_provider is edge or openai. tts_fallback_provider is edge, openai, or none; default edge keeps fallback free.",
    "speed": 1.25,
    "master_volume": 1.0,
    "collapse_delay_sec": 3,
    "auto_prune": true,
    "auto_prune_sec": 20,
    "auto_continue_after_click": true,
    "recap_keep_min": 120,
    "palette_variant": "default",
    "tts_provider": "edge",
    "tts_fallback_provider": "edge"
  },

  "dictation": {
    "_comment": "Local Whisper cleanup removes filler words and spoken formatting commands before paste. cleanup_provider 'openai' is opt-in and can spend API credits; it falls back to local cleanup if unavailable.",
    "cleanup": true,
    "cleanup_provider": "local",
    "cleanup_model": "gpt-5.4-mini",
    "cleanup_timeout_sec": 20,
    "keep_audio": false,
    "save_timing": true
  },

  "speech_includes": {
    "_comment": "Global defaults for what gets spoken from assistant responses. tool_calls covers Claude hook events and Codex rollout tool events when available. Per-session overrides live in session-colours.json and win over these.",
    "code_blocks": false,
    "inline_code": false,
    "urls": false,
    "headings": true,
    "bullet_markers": false,
    "image_alt": false,
    "tool_calls": true
  },

  "heartbeat_enabled": true,

  "wake_words": ["hey_jarvis"],

  "update_check_enabled": true,
  "update_check_interval_min": 60,

  "panels": {
    "_comment": "Toolbar panel state; managed by the app.",
    "transcript_expanded": false,
    "transcript_view": "spoken",
    "create_session_window_placements": {
      "_comment": "Optional advanced recording aid. Keys can be labels like Claude TT A or kind:index values like codex:5. Values can be bounds strings like -1008,-1080,960,516, or objects with windowPosition/windowSize/windowBounds."
    }
  },

  "selected_tab": "all",
  "tabs_expanded": false,

  "window": {
    "_comment": "Populated automatically — last-saved position + dock orientation. Delete these keys to reset to centred-top on next launch.",
    "x": null,
    "y": null,
    "dock": null
  },

  "openai_api_key": null
}
